{
  "draft_id": "k3x9q2",
  "kind": "new_place",
  "round": 1,
  "attempt": 0,
  "stages": {
    "survey": {
      "started_at": "2026-11-01T10:00:00+02:00",
      "finished_at": "2026-11-01T10:06:00+02:00",
      "result": "ok",
      "rounds": 2
    }
  },
  "cost": {
    "muse-spark-1.3": {
      "input_tokens": 12000,
      "output_tokens": 3000,
      "searches": 14,
      "images": 0,
      "cost_usd": 0.06275
    }
  },
  "budget": {"job_budget_usd": 8.0, "daily_budget_usd": 20.0, "max_new_species": 3},
  "log_uri": "jobs/job-1/log.jsonl"
}
